category,title,url,timestamp,article
Singapore,"2 public entertainment outlets on Middle Road suspected of providing hostessing services, 31 people arrested",https://www.channelnewsasia.com/singapore/31-arrested-public-entertainment-outlets-middle-road-hostessing-service-police-2923036,1662458522,"SINGAPORE: Two public entertainment outlets along Middle Road were found to have allegedly provided hostessing services during an enforcement operation on Saturday (Sep 3), resulting in 31 people arrested. Twenty-nine women were suspected of providing hostessing services, and they were arrested for working without a valid work permit, said police in a news release on Tuesday. They were aged between 20 and 33. Two men, 31 and 35, were arrested for offences related to the employment of foreign manpower. “The two outlets, which allegedly provided hostessing services within their premises, were found to have contravened the Public Entertainment Act 1958,” said the police. The two outlets were not named in the news release. Anyone who provides or assists in providing any public entertainment in contravention of the Act can be fined up to S$10,000. Those found employing a foreign employee without a valid work pass face a fine of between S$5,000 and S$30,000, a jail term of up to 12 months, or both. The offence of being in employment without a valid work pass carries a jail term of up to two years, a fine of up to S$20,000, or both. “The police will continue to carry out regular enforcement checks on public entertainment and nightlife establishments to suppress illicit activities,” police said in the news release."
World,"Mother of two, first responder among those killed in Canada stabbings",https://www.channelnewsasia.com/world/victims-canada-stabbing-mother-two-first-responder-2921916,1662447540,"JAMES SMITH CREE NATION, Saskatchewan: A mother of two, a 77-year-old widower and a first responder were the initial victims identified in a stabbing spree in Canada that killed 10 people and wounded at least 18 others. Canadian police said on Monday (Sep 5) they found one of the suspects in the mass stabbing spree dead while the other suspect, his brother, remained at large. Police are still trying to determine a motive for Sunday's attacks, mostly in a sparsely populated indigenous community, that shocked a country where mass violence is rare. The incidents took place in the James Smith Cree Nation and village of Weldon in the province of Saskatchewan, police said. Hours before the stabbings, Lana Head, a mother of two daughters, posted on Facebook that she had ""so many good memories to cherish"". Head's friends and family were shocked by her death and paid tributes on social media. ""Not the way I wanted her to leave this world,"" said Melodie Whitecap, Head's childhood friend who had planned to visit her before the stabbing. Head's former partner also spoke to local media and implied the stabbings might have been related to drugs and alcohol. ""It's sick how jail time, drugs and alcohol can destroy many lives,"" Michael Brett Burns, Head's former partner, told the Aboriginal Peoples Television Network. A statement by indigenous leaders also indicated the attacks might have been drug-related. Ivor Burns and Darryl Burns from the James Smith Cree Nation told Reuters their sister, Gloria, was among the dead. They blamed drugs and alcohol as well. ""We have 10 people dead, including my sister. She was butchered ... with her friend and a 14-year-old boy, all three of them,"" Ivor Burns said in an interview."
Singapore,Man stopped by police for behaving suspiciously at train station jailed for having sex videos ,https://www.channelnewsasia.com/singapore/man-jailed-obscene-videos-sex-women-transcom-court-train-station-2922746,1662446078,"SINGAPORE: A man stopped by police officers for behaving suspiciously at a train platform was later revealed to possess illegally obtained videos of himself having sex with women. Malaysian Khoo Ee Seong, 29, was sentenced on Tuesday (Sep 6) to 20 weeks' jail and a fine of S$4,000. He pleaded guilty to four counts of intruding on a woman's privacy with intention to insult her modesty and one charge of possessing obscene films. Another 10 charges were considered in sentencing. The court heard that Khoo was at the platform of Paya Lebar MRT Station on the afternoon of Feb 10, 2019, when officers attached to the Transcom Patrol Unit spotted him behaving suspiciously. They approached Khoo and checked his belongings. They found videos of Khoo having sex with an unknown woman in his two phones, and they also found three thumb drives on Khoo. Khoo admitted that there were obscene films stored in the drives, and he was arrested and his devices seized. Forensic examination of Khoo's first phone uncovered five videos of him having sex with different women. He had paid a woman for sex with him at his flat at about 2.45am on Jul 12, 2017. He placed his phone in a corner of the room with the video-recording mode on before the woman arrived and filmed her having sex with him without her knowledge. Another video of Khoo having sex with a woman was found on his other phone. He paid this woman for sex with him at her flat at about 5.30pm on Jan 2, 2019, and again set up his phone to record the encounter without her knowledge. The first of Khoo's thumb drives contained videos of him having sex with two other women in the same manner, while the remaining three thumb drives contained eight obscene films. He had downloaded these films from pornography websites and saved them for personal viewing. One of them was more than 46 minutes long. For intruding on a woman's privacy with intention to insult her modesty, he could have been jailed up to a year and fined per charge. For possessing obscene films, he could have been fined S$500 per film with a cap of S$20,000, jailed up to six months, or both."
Singapore,"Former ITE lecturer jailed for taking upskirt shots on campus, had 133 illicit photos",https://www.channelnewsasia.com/singapore/upskirt-ite-lecturer-campus-jail-student-2922646,1662442500,"SINGAPORE: A former lecturer with the Institute of Technical Education was jailed for four months on Tuesday (Sep 6) for taking multiple upskirt photos and videos on campus. The 48-year-old man's victims included students and a female target in the cafeteria of an Institution of Technical Education. A gag order was imposed barring the publication of any information that might identify the victims. The man pleaded guilty to two counts of insulting a woman's modesty and a third charge of attempting to insult a woman's modesty. Three other charges were taken into consideration for sentencing. The court heard that the offender was working at an Institute of Technical Education at the time of the offences. On Oct 25, 2019, he was teaching a Life Skills class when he spotted a student wearing a tight skirt revealing her legs. He selected her as his target and walked towards her with his phone camera switched on. On the pretext of assisting her with her work, the man placed his phone at the edge of the table before taking several photos using the volume button on his phone. When the class ended, he ensured no one was around and looked at the photos before realising he had failed to capture any images or videos of the student. Meanwhile, the student had spotted the lecturer positioning his phone camera lens towards her skirt. She immediately texted her father, sister and classmates, and her sister reported the matter to the police. His phone was seized and at least 133 upskirt images and 17 videos were extracted from it. Police investigations revealed the offender's modus operandi: He would look out for female students with short skirts around the school. He would also look out for female students who were ""sitting improperly in his lecture class"", court documents said. He would then turn on the camera function on his phone before approaching his target under the guise of teaching her. He would then photograph or record up the student's skirt and review the footage after the lesson was over. By the accused's own estimates, he filmed such upskirt videos and photos over the course of four to five months at a frequency of once a fortnight. He took an upskirt photo and video of an unidentified female victim in the school cafeteria on Jun 5, 2019, and an upskirt video of another victim at the school's general office on Jul 29, 2019. The prosecutor asked for between four and six months' jail, saying that the offender had abused his position of trust and authority as a lecturer. He had a number of upskirt photos and videos, and committed the offences in a covert manner, she said. For each charge of insulting a woman's modesty, he could have been jailed for up to a year and fined."
World,Malaysian contractor at heart of US Navy's biggest corruption scandal flees house arrest,https://www.channelnewsasia.com/world/fat-leonard-francis-us-navy-worst-corruption-scandal-flees-gps-2922446,1662436095,"WASHINGTON: A military contractor who pleaded guilty in the US Navy's worst corruption scandal has escaped house arrest in San Diego, the US Marshals Service said on Monday (Sep 5). ""Leonard Francis cut off his GPS monitoring ankle bracelet Sunday morning,"" Supervisory Deputy US Marshal Omar Castillo told AFP in a statement. Widely known as ""Fat Leonard"", Francis was due to be sentenced in three weeks, US media said. Francis, a Malaysian national who ran a military contracting company out of Singapore, pleaded guilty in 2015 to offering about US$500,000 in bribes to Navy officers to steer official work to his shipyards, carrying out work on US vessels that prosecutors say he overcharged the Navy for, to the tune of US$35 million. Police were sent to his San Diego residence on Sunday after the agency monitoring his ankle bracelet reported a problem with the device, Castillo said. ""Upon arrival they noticed that nobody was home,"" he said. ""They then notified US Marshals who went to the house and verified that he was no longer there. As of now multiple leads are being investigated."" The San Diego Union-Tribune reported that the cut-off GPS bracelet was found in the house, while neighbours said they had seen U-Haul moving trucks coming and going at the property in the days leading up to his escape. Francis was arrested in 2013 and pleaded guilty two years later. He suffered numerous health problems, including kidney cancer, which led to him being released to house arrest in 2018 while acting as a cooperating witness for federal prosecutors. He was due to be sentenced on Sep 22. Four Navy officers have been found guilty in the case so far, while another 29 people, including naval officials, contractors and Francis himself, have pleaded guilty, US media said."
Singapore,Felicia Teo case: Suspect gets new date to plead guilty to lesser offences including depositing her corpse,https://www.channelnewsasia.com/singapore/felicia-teo-case-suspect-ahmad-danial-missing-set-plead-guilty-lesser-offences-depositing-corpse-2922481,1662433460,"SINGAPORE: A man linked to the case of Ms Felicia Teo Wei Ling, who was reported missing in 2007 and later presumed dead, is set to plead guilty to lowered charges including depositing her corpse. Ahmad Danial Mohamed Rafa'ee, 37, was originally charged in December 2020 with the murder of Ms Teo, who was 19 when she went missing. He was earlier accused of murdering her between 1.39am and 7.20am on Jun 30, 2007 at a flat in Block 19, Marine Terrace with suspected accomplice Ragil Putra Setia Sukmarahjana, who is at large. However, in June this year, Ahmad Danial was given a discharge not amounting to an acquittal for the murder charge and released from remand. He was given six new charges, all of which are in common intention with Mr Ragil, meaning they allegedly committed the offences together. The offences include depositing Ms Teo's corpse at the vicinity of Punggol Track 24 around Jun 30, 2007, misappropriating Ms Teo's handphone, Apple Macbook Pro and camera, as well as failing to report information about Ms Teo's death to the police. The remaining offences are for giving false information to the police, fabricating false evidence by placing Ms Teo's phone in East Coast Park, and fabricating false evidence by making calls to Ms Teo's phone, leaving her voicemails and sending her messages on social media to create the false impression that both men believed Ms Teo was alive although they knew she was dead. Ahmad Danial was set to plead guilty in July but the hearing was adjourned for both sides to resolve issues including the facts, sentencing and documentation. He will next return to court on Oct 14 to enter his guilty plea and is out on bail of S$20,000. Those convicted of depositing a corpse can be jailed up to six months, fined up to S$2,000 or both. Anyone who fabricates false evidence can be jailed up to seven years or fined. The punishment for misappropriating the property of a dead person is up to three years' jail and a fine. The penalty for omitting to give information to public servants as required by the law is up to one month's jail and a fine of up to S$500. Anyone who gives false information to a public servant can be jailed up to six months, fined up to S$1,000 or both."
Singapore,S$1b Envy Global fraud case: Lawyers for man accused of helping ex-director in escape bid discharge themselves,https://www.channelnewsasia.com/singapore/envy-global-fraud-case-1-billion-lawyers-discharged-2922431,1662432900,"SINGAPORE: Lawyers representing a man accused of conspiring to help a businessman linked to a billion-dollar fraud case flee Singapore discharged themselves on Tuesday (Sep 6). Shawn Liew Cheng Long, 36, failed to respond to his lawyers since the last court mention. On Tuesday morning, a warrant of arrest was issued for Liew when he did not show up in court. But he turned up later that morning and explained that he was late. The arrest warrant was then withdrawn. He was told to engage new lawyers by the next court mention and to return to court on Sep 27. Liew was charged in July with one count of conspiring with another man to assist the former managing director of Envy Global Trading Ng Yu Zhi to leave Singapore illegally. This was when Ng was under investigation for criminal offences. Liew is accused of engaging in a conspiracy with Ang Yew Teck around August 2021 to help Ng leave Singapore and obstruct the course of justice. He allegedly offered Ng plans to leave the country. Ang was given a similar charge in February and faces other offences including illegal gambling acts. The police previously said in a statement that this case is separate from another bid by three others to help Ng escape. All three have been sentenced to jail. Ng faces more than 100 charges, including cheating and criminal breach of trust. One of the charges is for dishonestly misappropriating at least S$201.2 million from Envy Global Trading's DBS bank account between August 2020 and February 2021. His alleged victims include a criminal lawyer who was allegedly cheated in an arrangement involving more than S$1 million between October 2020 and January 2021, as well as a woman listed as general counsel on Temasek's website. She was allegedly cheated into giving S$5.5 million to Envy Global Trading for four receivables purchase agreements between October 2020 and January 2021. Ng is also accused of cheating a former president of the Law Society of Singapore of about S$87,000 between October 2020 and December 2020. Ng is next set to return to court for a pre-trial conference in October."
